,path,sentence,language
3539,common_voice_id_26242854.mp3,"Diberi nama sesuai fitur geografis utamanya, stratovolcano Gunung Taranaki.",1
3540,common_voice_id_26242855.mp3,Laki-laki bertopi merah dan berrompi hitam dan kuning sedang memasak ikan.,1
3541,common_voice_id_26242856.mp3,"Malah, Aliprox adalah merek waralaba.",1
3542,common_voice_id_26242857.mp3,"Dikelilingi oleh Teluk Iligan, snorkeling dan pantai adalah beberapa atraksi yang dapat dinikmati.",1
3543,common_voice_id_26242858.mp3,"Tutup logam dapat dibentuk sebelumnya atau dalam beberapa kasus, digulung setelah penerapan.",1
3544,common_voice_id_26242863.mp3,Semua itu bukan hasil pengaruh langsung Tuhan.,1
3545,common_voice_id_26242865.mp3,Daerah ini berada di DeKalb County.,1
3546,common_voice_id_26242867.mp3,"Populasi planet menghasilkan produksi, terutama ketika dibantu oleh pabrik.",1
3547,common_voice_id_26242868.mp3,"Susannah York memainkan peran utama, dan film ini disutradarai oleh Tim Burstall.",1
3548,common_voice_id_26242918.mp3,"Karena kehidupan mereka yang damai dan indah, sangat mudah untuk mengalahkan mereka.",1
3549,common_voice_id_26242919.mp3,"Walau dilahirkan di Derry, dia tumbuh di County Donegal, Republik Irlandia.",1
3550,common_voice_id_26242920.mp3,"Emerson didampingi oleh London Philharmonic Orchestra, dengan konduktor John Mayer.",1
3551,common_voice_id_26242921.mp3,"Secara otodidak, dia mengikuti sayembara berhadiah.",1
3552,common_voice_id_26242922.mp3,"Armstrong dan istrinya, Sue, memiliki tiga putra: Tom, Joe, dan Dan.",1
3553,common_voice_id_26242930.mp3,"“Saya tidak melihat wine,” ia berkomentar.",1
3554,common_voice_id_26242931.mp3,Lalu kakak kita menjadi mabuk dengan cepat.,1
3555,common_voice_id_26242933.mp3,Balai Kota telah menjadi tempat sentral untuk acara-acara kreatif dan budaya.,1
3556,common_voice_id_26242934.mp3,Dia pulih dengan sangat baik.,1
3557,common_voice_id_26242949.mp3,"Katalog perpustakaan disebut ""Dadabase"".",1
3558,common_voice_id_26242952.mp3,Tersertifikasi platinum di berbagai negara termasuk Inggris.,1
3559,common_voice_id_26242954.mp3,"Namun, sebagian besar penduduk Fridley bekerja di luar Fridley.",1
3560,common_voice_id_26242955.mp3,"Seorang laki-laki muda jatuh dari domba yang telah dicukur dan di saat yang sama seorang koboi berlari untuk menolongnya,",1
3561,common_voice_id_26242956.mp3,Pada saat itu Amerika Serikat tidak bersedia untuk melakukannya.,1
3562,common_voice_id_26242972.mp3,Foster adalah pendukung minor di pemerintahan John Bracken.,1
3563,common_voice_id_26242974.mp3,"Ini lucu, dan agak benar juga!",1
3564,common_voice_id_26242976.mp3,Seorang wanita sedang bermain tenis sambil duduk di rumput.,1
3565,common_voice_id_26242977.mp3,"Kejuaraan Catur, dan karena mendapatkan skor positif melawan Garry Kasparov.",1
3566,common_voice_id_26242978.mp3,Kebanyakan departemen memiliki perpustakaannya sendiri.,1
3567,common_voice_id_26242992.mp3,"Penn benar-benar, akhirnya, berhenti setelah ronde keempat.",1
3568,common_voice_id_26242993.mp3,Seorang gadis sedang memegang pancing.,1
3569,common_voice_id_26242995.mp3,"Pada saat itu, penyanyi tersebut berkampanye untuk mendukung John F. Kennedy sebagai presiden.",1
3570,common_voice_id_26242996.mp3,"Bessell pindah menjadi sutradara, mengarahkan episode ""The Tracey Ullman Show"" dan ""Sibs"".",1
3571,common_voice_id_26242997.mp3,"Dia langsung ditunjuk sebagai Chief Whip oleh ketua partai, Liam Cosgrave.",1
3572,common_voice_id_26243010.mp3,"Kantor pusat Perusahaan North West dipindahkan ke utara, ke tempat yang mereka namakan Fort William.",1
3573,common_voice_id_26243011.mp3,Salah satu cara menggunakan tombol per widget yang segera menampilkan bantuan.,1
3574,common_voice_id_26243012.mp3,Niat mereka adalah untuk membuat partai independen mayoritas partai di legislatif.,1
3575,common_voice_id_26243014.mp3,Umpan video juga akan diberikan kepada media.,1
3576,common_voice_id_26243015.mp3,Semua hal baik akan datang kepada orang-orang yang mau menunggu,1
3577,common_voice_id_26243027.mp3,Mesin itu tiba di atas sebuah palet.,1
3578,common_voice_id_26243028.mp3,Dan itulah yang aku pikir membuatku ingin merekamnya.,1
3579,common_voice_id_26243029.mp3,Kapal induk adalah kapal utama kelompok saat ini.,1
3580,common_voice_id_26243030.mp3,Max Boyce lahir di Glynneath.,1
3581,common_voice_id_26243031.mp3,"Mengenai karya cipta lagu tersebut, Paul McCartney bilang, Aku rasa itu lagu milikku.",1
3582,common_voice_id_26243034.mp3,Saya ingin melakukan apa yang ingin saya lakukan.,1
3583,common_voice_id_26243036.mp3,Dia kemudian memimpin mereka kembali ke medan perang.,1
3584,common_voice_id_26243037.mp3,"Jadi pernahkah kamu, Bertie.",1
3585,common_voice_id_26243053.mp3,Chapman dimakamkan di Pemakaman Brookside.,1
3586,common_voice_id_26243055.mp3,"""Dari Rhodesia, kamu ingat."" ""Ya Tuhan, pembunuhnya!"" dia tersedak.",1
3587,common_voice_id_26243056.mp3,"Dalam satu misi, pemain harus membunuh putri kepala suku Orc.",1
3588,common_voice_id_26243059.mp3,"Delors dan Komisarisnya dianggap sebagai ""pendiri"" euro.",1
3589,common_voice_id_26243072.mp3,Juga dikenal dengan nama penjepit spons atau stik spons.,1
3590,common_voice_id_26243073.mp3,"Palfrey pernah berkata, Tenis adalah permainan terbaik yang pernah ada.",1
3591,common_voice_id_26243075.mp3,Ada juga single yang dirilis dalam volume yang sangat kecil.,1
3592,common_voice_id_26243077.mp3,Itu adalah permukiman pertama yang resmi pindah ke depot baru.,1
3593,common_voice_id_26243085.mp3,Jembatan-jembatan ini adalah bagian penting dari sejarah arsitektur Amerika Serikat.,1
3594,common_voice_id_26243086.mp3,Autogram juga disebut kalimat yang ‘menghitung dirinya sendiri’ atau yang ‘mendokumentasikan dirinya sendiri’.,1
3595,common_voice_id_26243088.mp3,Seorang laki-laki sedang menyapu lantai sebuah toko kecil,1
3596,common_voice_id_26243089.mp3,"Kota ini dikenal dengan julukan ""Ibu kota Ikan Bersirip Tinggi di Dunia"".",1
3597,common_voice_id_26243094.mp3,"Musim dingin hujan atau kadang-kadang bersalju, tetapi umumnya ringan.",1
3598,common_voice_id_26243095.mp3,Setiap siswa mengikuti satu cabang olah raga per semester.,1
3599,common_voice_id_26243097.mp3,Dia adalah juara tenis junior negara bagian di Utah selama enam tahun.,1
3600,common_voice_id_26243099.mp3,Hewan-hewan dikeluarkan dan dilatih oleh salah satu organisasi pertahanan tambahan nasional.,1
3601,common_voice_id_26244037.mp3,Saluran-D membawa informasi kendali dan pensinyalan.,1
3602,common_voice_id_26244038.mp3,Tidak ada tempat biasa: Radley College dan sistem sekolah umum.,1
3603,common_voice_id_26244039.mp3,Setiap mobil membutuhkan waktu sekitar satu minggu untuk selesai.,1
3604,common_voice_id_26244040.mp3,Dia adalah satu-satunya putri Benjamin Harrison yang masih hidup.,1
3605,common_voice_id_26244041.mp3,"Tidak hanya itu, sikapnya, dan kami punya masalah besar dengannya.",1
3606,common_voice_id_26244049.mp3,"‘Terima kasih,’ kata Alice, ‘sangat menarik’.",1
3607,common_voice_id_26244050.mp3,Raita juga memiliki perasaan padanya.,1
3608,common_voice_id_26244051.mp3,Mungkin aku berubah menjadi vegetarian.,1
3609,common_voice_id_26244053.mp3,"Namun, pertarungan sengit dilakukan setelah mereka terdeteksi.",1
3610,common_voice_id_26244054.mp3,Kapan waktu yang tepat bagi saya untuk menelepon kembali?,1
3611,common_voice_id_26244058.mp3,Ada beberapa kandidat untuk gelar peringatan pertama.,1
3612,common_voice_id_26244061.mp3,"Namun, Reagan menolak untuk mundur.",1
3613,common_voice_id_26244064.mp3,Saya menikmati kicauan buruk di jendela saya lebih buruk dari apa pun.,1
3614,common_voice_id_26244065.mp3,"Selama yang terakhir, dua kapal kelas “Colossus” melakukan serangan helikopter berbasis kapal pertama dalam sejarah.",1
3615,common_voice_id_26244066.mp3,"Dia juga ambil bagian dalam album Handsome Boy Modeling School, ""White People"".",1
3616,common_voice_id_26244069.mp3,"Walau begitu, Teman dalam sebagian besar tradisi biasa menggunakan istilah Pertemuan Tahunan.",1
3617,common_voice_id_26244070.mp3,"Carter mengumumkan ""Milenium"" ke Fox sebagai """" Tujuh ""di Seattle.",1
3618,common_voice_id_26244071.mp3,Stromberg diperankan oleh Curt Jurgens.,1
3619,common_voice_id_26244072.mp3,Pendidikan Tingkat Lanjut disediakan oleh Bridgwater College yang sebelumnya merupakan Bridgwater Technical School.,1
3620,common_voice_id_26244075.mp3,"Dia adalah pelatih yang sangat metodis, dan dia selalu ingin semuanya dilakukan dengan sempurna.",1
3621,common_voice_id_26244076.mp3,Produk ini mewakili lebih dari tiga puluh persen pasar derivatif kredit.,1
3622,common_voice_id_26244078.mp3,Celana putih dikenakan dengan ikat pinggang merah dan sebagian besar memakai sepatu merah.,1
3623,common_voice_id_26244079.mp3,Urutan kelahiran anak-anak Cooke tidak jelas.,1
3624,common_voice_id_26244083.mp3,"Jika Anda tidak yakin tautannya asli, cari di Google.",1
3625,common_voice_id_26244084.mp3,"Seperti dalam senyawa terkait, gugus hidroksil adalah hidrogen yang terikat pada senyawa keton.",1
3626,common_voice_id_26244085.mp3,Stasiun tersebut merupakan pengganti dari bekas Stasiun Kereta Bonair Reading.,1
3627,common_voice_id_26244086.mp3,Universitas memberikan gelar sarjana dan magister setiap tahun.,1
3628,common_voice_id_26244087.mp3,"Masyarakat di sepanjang perbatasan sungai kecil dan rawa, menyukai tanah subur yang dalam.",1
3629,common_voice_id_26244090.mp3,Tiga orang berkulit gelap berdiri berdekatan satu sama lain dengan bangunan besar sebagai latar belakang.,1
3630,common_voice_id_26244091.mp3,Anggota keluarga yang terkenal adalah termasuk bunga jewelweed dan bunga balsam.,1
3631,common_voice_id_26244092.mp3,"Akhirnya, Beatles mulai bermain di Jac pada waktu-waktu tertentu.",1
3632,common_voice_id_26244093.mp3,Saya tidak memiliki waktu untuk membeli pakaian dalam yang bergaya.,1
3633,common_voice_id_26244094.mp3,"Baik dalam bidang politik maupun pendidikan, dia adalah seorang reformis liberal.",1
3634,common_voice_id_26244096.mp3,"Lihat, di sana ada burung beo.",1
3635,common_voice_id_26244097.mp3,O’Toole mulai bermain polo air selama akhir musim renang pada umur tiga belas tahun.,1
3636,common_voice_id_26244098.mp3,"Terlahir di Louisville, Kentucky, Harrison belajar bola basket sejak kecil.",1
3637,common_voice_id_26244099.mp3,Kegunaannya terbatas untuk sedatif dan obat farmasi hipnotis.,1
3638,common_voice_id_26244100.mp3,"Oradell adalah pinggiran kota New York City, yang terletak kira-kira di barat laut Midtown Manhattan.",1
3639,common_voice_id_26244103.mp3,"Jika Anda mengenal Brinkley Court, Anda tidak akan menanyakan pertanyaan itu.",1
3640,common_voice_id_26244104.mp3,Apa ayahmu di jalan hidup yang sama dengan dirimu sendiri?,1
3641,common_voice_id_26244105.mp3,"Mineral terkait yang umum meliputi trona, natron dan halit.",1
3642,common_voice_id_26244106.mp3,Suara wanita yang paling tinggi,1
3643,common_voice_id_26244107.mp3,Dia mencuri PIN ke rekening banknya.,1
3644,common_voice_id_26244110.mp3,Tidak ada sistem penyejuk yang tersedia karena hanya bekerja beberapa kilo watt.,1
3645,common_voice_id_26244112.mp3,Kereta api dioperasikan terutama oleh sukarelawan.,1
3646,common_voice_id_26244113.mp3,Musik dalam pertunjukan biasanya hanya terbatas pada tema judul pembuka dan penutup.,1
3647,common_voice_id_26244114.mp3,Ansley hengkang dan digantikan oleh Pat Calpin.,1
3648,common_voice_id_26244117.mp3,"Truro Utara juga merupakan tempat bagi Lapangan Golf Highland Links, lapangan links tertua Massachusetts.",1
3649,common_voice_id_26244118.mp3,Carr menyerahkan diri pada pagi harinya dan kemudian mengaku bersalah atas pembunuhan.,1
3650,common_voice_id_26244119.mp3,"Mereka berbagi rumah di Cincinnati dan Homosassa, Florida.",1
3651,common_voice_id_26244121.mp3,Ekonom gemar memberikan prediksi Ekonomi.,1
3652,common_voice_id_26244122.mp3,"Dia sekarang tinggal di Boca Raton, Florida.",1
3653,common_voice_id_26244124.mp3,Ini mengajar sains dan humaniora.,1
3654,common_voice_id_26244125.mp3,"Sungai Stanislaus menawarkan area untuk arung jeram, mendayung kayak, berenang, memancing, berkemah, dan mendaki.",1
3655,common_voice_id_26244126.mp3,"Dikombinasikan dengan skandal korupsi, kasus ini sangat melemahkan partai.",1
3656,common_voice_id_26244127.mp3,Ada tiga anak di luar sedang duduk.,1
3657,common_voice_id_26244128.mp3,Morley menulis sebuah buku terkenal yang berisi biografi para penulis Inggris terkenal.,1
3658,common_voice_id_26244130.mp3,Stasiun Chester.,1
3659,common_voice_id_26244131.mp3,Suara vowel open-mid pendek juga berbeda-beda tergantung pada lingkungannya.,1
3660,common_voice_id_26244132.mp3,Kamu tidak bisa melakukan itu!,1
3661,common_voice_id_26244133.mp3,"Melihat matahari, dia menghitung bahwa dia akan mencapai Tarifa sebelum tengah hari.",1
3662,common_voice_id_26244136.mp3,Ini akan dipasarkan oleh Soulseller Records.,1
3663,common_voice_id_26244137.mp3,Slippery Rock Creek mengalir melewati bagian tenggara kota melalui Boyers.,1
3664,common_voice_id_26244138.mp3,Ini adalah Sesar Cobequid.,1
3665,common_voice_id_26244141.mp3,"Dua kakak laki-laki, Sir Henry dan Thomas, meninggal tanpa diketahui.",1
3666,common_voice_id_26244145.mp3,"Ia terkenal dengan temuannya, diode Esaki, yang mengeksploitasi fenomena itu.",1
3667,common_voice_id_26244146.mp3,"Orang yang selamat hanya Pangeran Arus dan putri seorang jenderal, Lunafrea.",1
3668,common_voice_id_26244147.mp3,"Dengan demikian, 'gambar' tidak terbentuk.",1
3669,common_voice_id_26244148.mp3,Apa kau yakin dia aman?,1
3670,common_voice_id_26244153.mp3,"""Maikaze"" sendiri tenggelam dengan semua awak kapalnya.",1
3671,common_voice_id_26244154.mp3,Ketiganya terdiam.,1
3672,common_voice_id_26244155.mp3,Seorang tukang yang sedang menghaluskan beton.,1
3673,common_voice_id_26244157.mp3,Perhatian utama pembeli dan penjual labu bergalur adalah busuk buah.,1
3674,common_voice_id_26244163.mp3,"Dengan tidak menyampingkan plot, beberapa pengulas berpikir bahwa karya itu melampaui genre novel tentang mata-mata.",1
3675,common_voice_id_26244165.mp3,Presiden biasanya diminta untuk memberikan komentar saat makan malam.,1
3676,common_voice_id_26244167.mp3,Tapi jangan biarkan ia mengganggumu.,1
3677,common_voice_id_26244169.mp3,Liga baru lainnya adalah Liga Hoki Junior A Quebec.,1
3678,common_voice_id_26244170.mp3,Salah satu murid terpenting Scarsellino adalah Costanzo Cattani.,1
3679,common_voice_id_26244176.mp3,Dia pertama kali melakukan stand-up karena ditantang saat menjadi mahasiswa musik di Universitas Rutgers.,1
3680,common_voice_id_26244177.mp3,Latar belakang Isadore Witmark dulunya penjual saringan air.,1
3681,common_voice_id_26244178.mp3,"Prosesnya bertahap, penuh kontradiksi, dan juga dipenuhi ketegangan dari dalam.",1
3682,common_voice_id_26244179.mp3,Bentuk atau perlawanan seperti itu menyebabkan warga lokal ini dianggap musuh dari Revolusi.,1
3683,common_voice_id_26244181.mp3,The Woods mudah dicapai melalui bus dan Metro Warsawa.,1
3684,common_voice_id_26244187.mp3,"Namun, ia tidak muncul untuk sesi rekaman apa pun.",1
3685,common_voice_id_26244188.mp3,Versi beranda memungkinkan pemain untuk memilih dari tiga mode kesulitan.,1
3686,common_voice_id_26244189.mp3,"Sapi ini merupakan jenis dengan fungsi ganda, diternakkan untuk dagingnya dan untuk diperah.",1
3687,common_voice_id_26244190.mp3,Stefansson masih menjadi penjelajah yang terkenal hingga akhir hayatnya.,1
3688,common_voice_id_26244191.mp3,Tesis ini telah diakui sebagai konfirmasi holisme.,1
3689,common_voice_id_26244196.mp3,Minnesota Twins memenangkan tujuh pertandingan.,1
3690,common_voice_id_26244198.mp3,Pusat kota Greensboro berada di timur laut.,1
3691,common_voice_id_26244199.mp3,Lagu “Largactyl” ditulis tentang pengalaman Martin.,1
3692,common_voice_id_26244200.mp3,Kota Hardisty ada berkat Kereta Api Pasifik Kanada.,1
3693,common_voice_id_26244201.mp3,"Banyak kota memiliki departemen kepolisian mereka sendiri, seperti halnya banyak perguruan tinggi dan universitas di Massachusetts.",1
3694,common_voice_id_26244202.mp3,"Dia mempunyai dua kakak laki-laki, John dan Barry.",1
3695,common_voice_id_26244204.mp3,Memesan reservasi untuk pub yang menyediakan croquembouche,1
3696,common_voice_id_26244205.mp3,Tidak ada alasan apa pun untuk itu.,1
3697,common_voice_id_26244206.mp3,Perahu jet beroperasi di sungai ini.,1
3698,common_voice_id_26244208.mp3,Blizzard melaporkan menangani ribuan larangan semacam itu sehari dari Korea Selatan.,1
3699,common_voice_id_26244213.mp3,Ancaman bahkan terucap bahwa Hayes tidak akan pernah dilantik.,1
3700,common_voice_id_26244215.mp3,Lihat literatur yang diberikan untuk teori domain.,1
3701,common_voice_id_26244216.mp3,"Ia lolos tanpa cedera, tetapi menteri perangnya, Marshal Bittencourt, meninggal saat melindunginya.",1
3702,common_voice_id_26244217.mp3,Informasi mengenai gereja ini pelan-pelan ditemukan dan diterjemahkan.,1
3703,common_voice_id_26244219.mp3,Delapan belas penerbangan terdampak.,1
3704,common_voice_id_26244220.mp3,Sebuah band memainkan acara rock di hadapan penonton bar,1
3705,common_voice_id_26244222.mp3,"Kondominium dikenal sebagai ""Con-doh"" dan hampir di Bangkok.",1
3706,common_voice_id_25902154.mp3,"Namun, juri tidak dapat mencapai vonis.",1
3707,common_voice_id_25902155.mp3,"Di kota itu, ia merasa kesulitan dalam bekerja karena kemampuan bahasa Inggrisnya buruk.",1
3708,common_voice_id_25902166.mp3,"Dia berkata, ""Saya sadar, saya membuat semua orang kaya, dan di sini saya miskin.""",1
3709,common_voice_id_25902167.mp3,Roket diluncurkan dari Cape Canaveral pukul dua tiga puluh satu pagi.,1
3710,common_voice_id_25902168.mp3,Sprint mencoba mengatasi ini dengan munculnya telepon PowerSource.,1
3711,common_voice_id_25902169.mp3,Seorang gadis dengan legging hitam dan jaket merah sedang berlatih skating.,1
3712,common_voice_id_25902180.mp3,"Sejak saat itu ia menjadi musuh secara terus menerus dari putra kesayangan Odin, Thor.",1
3713,common_voice_id_25902181.mp3,Burung ini memiliki punggung berwarna cokelat dan bagian bawahnya abu-abu yang menjadi pembeda dengan spesies yang lebih besar.,1
3714,common_voice_id_25902183.mp3,"Tempat itu berdiri hanya selama satu dekade, sebelum gempa bumi meratakannya.",1
3715,common_voice_id_25902194.mp3,Cabang legislatif terdiri dari sembilan anggota dewan terpilih.,1
3716,common_voice_id_25902195.mp3,Itu juga merupakan jalan raya utama yang menghubungkan Winnipeg ke Manitoba utara.,1
3717,common_voice_id_25902197.mp3,Malam yang menyedihkan itu mulai berakhir.,1
3718,common_voice_id_25902198.mp3,"Michael Lee bekerja sebagai pemain drum, sering tampil bersama Robert Plant.",1
3719,common_voice_id_25902202.mp3,Webster bergabung dengan pendiri di dewan direksi.,1
3720,common_voice_id_25902203.mp3,Dia adalah seorang penyair puisi.,1
3721,common_voice_id_25902204.mp3,"Burung Bluebird adalah pemangsa serangga yang lahap, dengan cepat mereka membersihkan kebun dari hama serangga.",1
3722,common_voice_id_25902205.mp3,Johnson mengambil sumpah dari jaksa Agung Ohio Thomas J. Moyer.,1
3723,common_voice_id_25902206.mp3,Grant adalah anggota suku Omaha dari Nebraska.,1
3724,common_voice_id_25902210.mp3,Saya telah belajar untuk mencintai Westerbork.,1
3725,common_voice_id_25902211.mp3,Apakah ini produk non-hewani?,1
3726,common_voice_id_25902212.mp3,Leukosit mati akan menyisakan seperti nanah kuning kental.,1
3727,common_voice_id_25902214.mp3,Orang-orang Turki mulai bertempur dengan warga setempat yang sebagian besar tidak bersenjata.,1
3728,common_voice_id_25902222.mp3,Livy tidak menyebutnya.,1
3729,common_voice_id_25902228.mp3,Apakah dia kembali ke sini?,1
3730,common_voice_id_25902230.mp3,Semuanya ini meningkatkan minat dalam jazz yang terus berlanjut hingga setelah perang.,1
3731,common_voice_id_25902231.mp3,"Elemen rumah Eisenhower di Abilene, Kansas akan disertakan, menurut komisi.",1
3732,common_voice_id_25902232.mp3,"Para siswa, administrator, lulusan dan keluarga saat ini, semuanya sangat dipengaruhi oleh keputusan tersebut.",1
3733,common_voice_id_25902246.mp3,Wanita yang mengenakan pakaian eksotis berdiri di jalan,1
3734,common_voice_id_25902247.mp3,Seorang pria berjanggut dengan kemeja lengan panjang bernyanyi dengan mikrofon.,1
3735,common_voice_id_25902248.mp3,"Di antara titik-titik kalibrasi tetap, interpolasi akan digunakan, yang biasanya linier.",1
3736,common_voice_id_25902279.mp3,"""Wadsworth"" juga dilengkapi dengan delapan tabung torpedo.",1
3737,common_voice_id_25902280.mp3,Dia meninggalkan Priority setelah label ditutup dan menandatangani dengan Agensi Rekaman Agensi.,1
3738,common_voice_id_25902281.mp3,Persidangan dimulai pada pertengahan September.,1
3739,common_voice_id_25902365.mp3,"Anda tidak ingin sakit, bukan?",1
3740,common_voice_id_25902366.mp3,Perusahaan itu juga menunjukkan bahwa saluran tersebut tersedia di Dish Network.,1
3741,common_voice_id_25902367.mp3,Mission Bay saat ini adalah kantor pusat California Institute for Regenerative Medicine.,1
3742,common_voice_id_25902370.mp3,Proyek tersebut ditelantarkan saat Taylor dipaksa keluar dari kepemimpinan perusahaan.,1
3743,common_voice_id_25902393.mp3,"Begitu mereka mendarat, anggota korps harus melakukan sesi wawancara untuk melamar pekerjaan seperti orang-orang lainnya.",1
3744,common_voice_id_25902394.mp3,Williamson ditandatangani untuk kontrak liga minor oleh Atlanta Braves pada bulan April.,1
3745,common_voice_id_25902396.mp3,"Dia sekarang tinggal di Havana,Cuba.",1
3746,common_voice_id_25902397.mp3,Pesawat kedua dibuat di Perusahaan Pesawat Peregrine di Minden Nevada.,1
3747,common_voice_id_25902399.mp3,Gitaris utama yang baru adalah Marco Gerace.,1
3748,common_voice_id_25902426.mp3,Wanita bermain bola voli sementara dua wasit mengelola permainan.,1
3749,common_voice_id_25902428.mp3,Dia dimakamkan di Gereja Saint Marry.,1
3750,common_voice_id_25902429.mp3,Model dasar Solow tidak bisa menjelaskan mengapa produktivitas lebih rendah di negara-negara ini.,1
3751,common_voice_id_25902449.mp3,Kerangka kerja darurat diperlukan jika kita ingin menghindari mogok.,1
3752,common_voice_id_25902451.mp3,"Jalan raya ini sebagai penghormatan atas penemu Brazil, Alberto Santos Dumont, yang kerap disebut “Bapak Penerbangan”.",1
3753,common_voice_id_25902452.mp3,"Profesi Brepoels adalah arsitek, setelah belajar arsitektur di Hasselt.",1
3754,common_voice_id_25902453.mp3,Mereka juga digunakan untuk menekan debu di jalan yang tidak beraspal.,1
3755,common_voice_id_25902454.mp3,Tersirat bahwa Pete menyelamatkan Audrey dengan melindunginya dengan tubuhnya.,1
3756,common_voice_id_25902487.mp3,Sebuah desa pribumi juga terletak agak jauh.,1
3757,common_voice_id_25902488.mp3,Kopi Khas Arbor Day yang ditanam di bawah kanopi pohon adalah bagian lain dari program Rain Forest Rescue.,1
3758,common_voice_id_25902490.mp3,Sebagian besar pembelot Korea Utara yang menetap di Korea Selatan berasal dari Hamgyong Utara.,1
3759,common_voice_id_25902510.mp3,Sebuah bus dari kota ini terhubung dengan sebagian besar kereta pada hari Senin hingga Sabtu.,1
3760,common_voice_id_25902512.mp3,Itu beberapa waktu sebelum dia menemukan topinya.,1
3761,common_voice_id_25902513.mp3,"Ia mendeskripsikan gaya kerjanya yang kerja empat belas jam sehari penuh dengan ekstasi, siksaan dan penundaan.",1
3762,common_voice_id_25902538.mp3,"Secara keseluruhan, kromosom X fungsional biasanya berasal dari ibu.",1
3763,common_voice_id_25902539.mp3,Tujuh orang berpose di atas bangunan yang membentang di atas area berair dan laut.,1
3764,common_voice_id_25902540.mp3,Terjemahan lain menggunakan ejaan bahasa Inggris asli dari istilah Nadsat.,1
3765,common_voice_id_25902541.mp3,"""More Adventurous"" menyinggung pepatah buku Frank O'Hara Meditations in an Emergency.",1
3766,common_voice_id_25902542.mp3,Satu orang mitra Wachtell menilai bahwa dia nampak sangat tidak menyukai proses pengadilan yang membosankan.,1
3767,common_voice_id_25902560.mp3,Ini tumbuh dengan subur di daerah beriklim sedang.,1
3768,common_voice_id_25902563.mp3,Mereka berencana untuk menangkap kembali Frank.,1
3769,common_voice_id_25902606.mp3,Mereka memiliki empat putri dan satu putra bersama-sama.,1
3770,common_voice_id_25902627.mp3,"""Sastra"", menurutnya, ""adalah, antara lain, retorika prinsipiel"".",1
3771,common_voice_id_25902628.mp3,Dia telah mendaftar Full Tilt Poker.,1
3772,common_voice_id_25902629.mp3,Penelitian baru menunjukkan bakteri dari perjalanan penyakit gusi melalui saluran udara dan ke paru-paru.,1
3773,common_voice_id_25902630.mp3,Bagian ini menjadi Subdivisi Timur.,1
3774,common_voice_id_25902672.mp3,Kassar merasa bahwa chipset harus digunakan di untuk komputer rumahan untuk menantang Apple.,1
3775,common_voice_id_25902673.mp3,"Selama masa jabatannya sebagai wali kota, Calgary menjamu anggota tamu terkemuka.",1
3776,common_voice_id_25902693.mp3,Distribusi adalah jenis lain dari proyek sumber terbuka.,1
3777,common_voice_id_25902694.mp3,"Dia jarang rukun dengan Jughead, karena kecerobohannya.",1
3778,common_voice_id_25902769.mp3,Kota Ada menurut tradisi menjadi kubu Partai Republik.,1
3779,common_voice_id_25902771.mp3,Apakah kamu punya? tanya Scarecrow.,1
3780,common_voice_id_25902774.mp3,"Kartun ketiga, Duck!",1
3781,common_voice_id_25902775.mp3,Statistik secara luas digunakan dalam penelitian psikologi kuantitatif.,1
3782,common_voice_id_25902776.mp3,Kucing-kucing sering belajar bermain permainan seperti 'mengambil' dan 'menandai'.,1
3783,common_voice_id_25902777.mp3,"Di dekat pantai Estonia, mereka terpental oleh sepuluh pejuang Soviet.",1
3784,common_voice_id_25902778.mp3,Lambung gunung berupa cincin berwarna coklat kemerahan besar di sekitarnya.,1
3785,common_voice_id_25902789.mp3,"""Tertangkap dalam Draft"" adalah ingatan nostalgia akan layanan nasional wajib.",1
3786,common_voice_id_25902791.mp3,Wakeboarder melompat ke udara dari ombak,1
3787,common_voice_id_25902792.mp3,"Ia adalah adik laki-laki dari Andy Dawson dan Kevin Dawson, yang juga bermain football.",1
