,path,sentence,language
2520,common_voice_id_26228010.mp3,"Sejak awal, liga memperbolehkan tim menggunakan pemain profesional secara terbuka.",1
2521,common_voice_id_26228011.mp3,Pengalamannya selama di penjara mengubah pandangannya dan cara kerjanya.,1
2522,common_voice_id_26228012.mp3,Ketidakpuasan meningkat di antara penduduk voivodeship timur.,1
2523,common_voice_id_26228013.mp3,Robot tidak akan menghancurkan kemanusiaan.,1
2524,common_voice_id_26228024.mp3,Salmon Atlantik menghabiskan waktu di laut antara satu sampai empat tahun.,1
2525,common_voice_id_26228025.mp3,Burung Pitta Gurney hampir punah.,1
2526,common_voice_id_26228026.mp3,"Di panggung New York, dia dikenal karena jangkauan dan fleksibilitasnya.",1
2527,common_voice_id_26228027.mp3,"Penemuan, bagaimanapun, dianggap sebagai kuda yang luar biasa tahun ini.",1
2528,common_voice_id_26228028.mp3,Juga memiliki kantor kecil untuk disewa dengan opsi Internet dan telepon.,1
2529,common_voice_id_26228037.mp3,Garza telah diterbitkan dalam berbagai antologi dan publikasi.,1
2530,common_voice_id_26228038.mp3,Sistem suara stereo digital juga menambah efek spesial dari planetarium.,1
2531,common_voice_id_26228039.mp3,Setelah kejadian itu dia berkesimpulan kesuksesan dan kegagalan itu saling berhubungan.,1
2532,common_voice_id_26228040.mp3,"Begitulah seharusnya belut, tetapi kita tidak benar-benar memahaminya "".",1
2533,common_voice_id_26228050.mp3,Pulau ini panjang dan bertambah tinggi tidak lebih dari permukaan laut.,1
2534,common_voice_id_26228052.mp3,Kaki depan terpendek dan memiliki cakar preapical untuk menusuk mangsa.,1
2535,common_voice_id_26228053.mp3,Tas kosong tidak bisa berdiri tegak.,1
2536,common_voice_id_26228054.mp3,Miyashita meninggalkan band saat hiatus.,1
2537,common_voice_id_26228057.mp3,Beberapa menyatakan bahwa dia pada saat itu menjadi arsitek teater terbesar di Australia.,1
2538,common_voice_id_26228058.mp3,Lebih banyak orang Amerika yang mulai tinggal di barat sungai tersebut.,1
2539,common_voice_id_26228060.mp3,Dia kini pelatih kepala di Rosario Central.,1
2540,common_voice_id_26228062.mp3,Dia juga bergabung.,1
2541,common_voice_id_26228064.mp3,Masih cukup sunyi dan sepi.,1
2542,common_voice_id_26228081.mp3,Rem daya standar.,1
2543,common_voice_id_26228082.mp3,"Perayaan ini mencakup musik, makanan, dan minuman khas.",1
2544,common_voice_id_26228083.mp3,Dia membantu saluran independen ini mengumpulkan uang.,1
2545,common_voice_id_26228084.mp3,Ia mengklaim berasal dari garis keturunan spiritual agama Mesir Kuno.,1
2546,common_voice_id_26228085.mp3,"Dan batu fondasi pelayanan, dalam kasusnya, adalah kepatuhan.",1
2547,common_voice_id_26228089.mp3,Disney adalah anggota charter grup tersebut.,1
2548,common_voice_id_26228090.mp3,Semua filmku bermakna spiritual dan semuanya memiliki perspektif yang emosional.,1
2549,common_voice_id_26228091.mp3,Namun saya tidak mungkin membiarkannya malam itu.,1
2550,common_voice_id_26228092.mp3,"Biasanya, rentang suhu di musim salju sangat besar.",1
2551,common_voice_id_26228093.mp3,Terdapat beberapa usaha di Encinal; sebagian besar telah ditutup di sepanjang jalan utama.,1
2552,common_voice_id_26228095.mp3,Para pemain harus menandatangani perjanjian kerahasiaan sebelum memainkan petualangan tersebut.,1
2553,common_voice_id_26228096.mp3,Ambil ranselmu dan cepat!,1
2554,common_voice_id_26228097.mp3,"Setidaknya, ada dua blog lain berbahasa mezangelle yang diketahui saat ini ditulis oleh mez.",1
2555,common_voice_id_26228098.mp3,Seorang pemain sepak bola berlari dengan membawa bola melewati pemain belakangnya,1
2556,common_voice_id_26228099.mp3,Novelis Sawako Ariyoshi memberi judul salah satu bukunya dengan nama sungai itu.,1
2557,common_voice_id_26228103.mp3,"Kurcaci menerima manusia, setengah elf dan orang kerdil.",1
2558,common_voice_id_26228107.mp3,"Fowler bersaudara menjelaskan diri mereka sebagai ""penjajah"" dan mereka diiklankan secara luas di kota.",1
2559,common_voice_id_26228109.mp3,Wrigley Field berada di dekat utara.,1
2560,common_voice_id_26228111.mp3,"Agensi juga mengeluarkan penasihat kerajinan kecil ke selatan melalui Charleston, South Carolina.",1
2561,common_voice_id_26228112.mp3,Distribusi curah hujan berubah arahnya dari utara ke selatan.,1
2562,common_voice_id_26228116.mp3,"Setelah hidup di atas tanah, kita akan berakhir di dalamnya",1
2563,common_voice_id_26228117.mp3,Dia memainkan sebagian besar peran gangster dalam film-film polisi saat itu.,1
2564,common_voice_id_26228119.mp3,Musikalnya penuh dengan kata-kata kotor.,1
2565,common_voice_id_26228121.mp3,Childish dan Thomson telah mengeluarkan beberapa manifestos.,1
2566,common_voice_id_26228129.mp3,Halibut Pasifik adalah ikan pipih terbesar di dunia.,1
2567,common_voice_id_26228130.mp3,Norwegia memiliki atlet angkat besi yang memenuhi syarat.,1
2568,common_voice_id_26228131.mp3,"Klon Dingo lainnya, ""Autoblinda Lince"" dikembangkan oleh Lancia, Italia.",1
2569,common_voice_id_26228132.mp3,Awal hidupnya tidak menentu.,1
2570,common_voice_id_26228133.mp3,Taman ini juga mencakup senapan dan lapangan olahraga lempung olahraga.,1
2571,common_voice_id_26228143.mp3,Dia diterima dan memenangkan tempat sebagai point guard di tim.,1
2572,common_voice_id_26228144.mp3,"Meskipun demikian, banyak Quebec Prancis tetap memusuhi Partai Liberal.",1
2573,common_voice_id_26228145.mp3,Dia kemudian maju dan terluka parah oleh tembakan musuh.,1
2574,common_voice_id_26228146.mp3,Terkadang mereka bertahan selama satu tahun dalam lalu lintas tinggi.,1
2575,common_voice_id_26228147.mp3,Seluruh negara didikte oleh pemerintah Tokugawa.,1
2576,common_voice_id_26228156.mp3,Asal mula nama Divisi Kingston adalah mengikuti namanya.,1
2577,common_voice_id_26228157.mp3,Kondisi musim panas pada umumnya sejuk dan musim dingin memiliki ciri banyak salju turun.,1
2578,common_voice_id_26228158.mp3,Partai Liberal memenangkan mayoritas tanah longsor dalam pemilihan di bawah David Peterson.,1
2579,common_voice_id_26228159.mp3,"Pengadilan militer adalah proses hukum dengan sistem perlawanan, layaknya semua pengadilan kriminal di Amerika Serikat.",1
2580,common_voice_id_26228160.mp3,"Single ini diyakini disebut ""Bombastic"" sebagaimana ejekan di halaman Instagram-nya.",1
2581,common_voice_id_26228168.mp3,"Bagian piano di ""Magic Piano Sparky"" dilakukan oleh Ray Turner.",1
2582,common_voice_id_26228169.mp3,Tidak ada yang berlanjut.,1
2583,common_voice_id_26228170.mp3,"Ini panjang, dan mendapat predikat “Sangat Sulit”.",1
2584,common_voice_id_26228171.mp3,Kapan Bunga dan Angry Waves akan ditampilkan?,1
2585,common_voice_id_26228172.mp3,Banyak keluarga Hindu juga menjadikan tempat ini sebagai rumah mereka.,1
2586,common_voice_id_26228182.mp3,Kearsarge adalah tujuan pendakian populer.,1
2587,common_voice_id_26228183.mp3,"Yang kedua adalah ""Shine It On"".",1
2588,common_voice_id_26228184.mp3,Mereka juga menggunakan bahasa Portugis di Mozambik dan bahasa Inggris di Zimbabwe.,1
2589,common_voice_id_26228185.mp3,Sebagian pembuat anggur di wilayah itu menggunakan fermentasi malolaktik dan sebagian lagi tidak.,1
2590,common_voice_id_26228186.mp3,"Dia membuka praktik di Evansville, Indiana.",1
2591,common_voice_id_26228195.mp3,"""Norfolk"" menabrakkan sisi kanan kapalnya ke sisi pelabuhan ""San Diego"".",1
2592,common_voice_id_26228197.mp3,Dia juga Pemimpin Demokrat untuk Kota Teluk Oyster selama bertahun-tahun.,1
2593,common_voice_id_26228198.mp3,Patrick berlatih di Drama Centre London.,1
2594,common_voice_id_26228199.mp3,"Beberapa bulan setelah ini, stasiun kembali ke format Active Rock.",1
2595,common_voice_id_26228200.mp3,"Oleh karena itu, yang ditemui Charles adalah seseorang yang dia kenal dari Australia.",1
2596,common_voice_id_26228206.mp3,Nannini selamat dari kecelakaan itu dengan sedikit memar.,1
2597,common_voice_id_26228208.mp3,"Mereka dikalahkan oleh pasangan China, Cai Yun dan Fu Haifeng.",1
2598,common_voice_id_26228209.mp3,Tamuku sedang berbaring telentang.,1
2599,common_voice_id_26228210.mp3,Mereka suka menghabiskan waktu dengan pemiliknya dan senang mendapat perhatian.,1
2600,common_voice_id_26228211.mp3,Namun Pengadilan perlahan menghindari mengesampingkan “Benson” atau “Flook”.,1
2601,common_voice_id_26228215.mp3,Fungsinya di sini lebih seperti penasihat bagi Kaisar.,1
2602,common_voice_id_26228216.mp3,"Dengan itu, ia menghancurkan perangkat tersebut.",1
2603,common_voice_id_26228217.mp3,Pedro pergi bekerja dengan menyetir selama empat puluh menit.,1
2604,common_voice_id_26228218.mp3,Salah satu orang terbaik yang pernah saya temui.,1
2605,common_voice_id_26228228.mp3,Hasil pencarian ini sedang menjalani pemeriksaan lebih lanjut.,1
2606,common_voice_id_26228229.mp3,Kursi paroki itu adalah Santo Francisville.,1
2607,common_voice_id_26228231.mp3,Pengoperasian kereta-kereta ini melibatkan lokomotif residen dan lokomotif jalur utama.,1
2608,common_voice_id_26228234.mp3,"Dia mempunyai kerabat di Distrik Pabbi Nowshera, dan di Quetta, Pakistan.",1
2609,common_voice_id_26228236.mp3,Apakah Anda berharap diterima?,1
2610,common_voice_id_26228241.mp3,Hal Roach membuat cerita-cerita tersebut ke dalam film yang terdaftar di bawah ini.,1
2611,common_voice_id_26228242.mp3,"add-ons lainnya memberikan dukungan faks, text-to-speech, codec tambahan dan fitur baru.",1
2612,common_voice_id_26228243.mp3,Bagaimana caramu membuat hal ini?,1
2613,common_voice_id_26228244.mp3,Ini kemungkinan merupakan pembantaian besar pertama terhadap penduduk asli benua tersebut.,1
2614,common_voice_id_26228262.mp3,Tidak terdistribusi karena kegunaannya tidak berlaku untuk semua pembawa ransel.,1
2615,common_voice_id_26228263.mp3,"Sebenarnya, Sacilotto berhasil memperoleh suara yang banyak untuk mengalahkan Carter tanpa perlu adanya preferensi.",1
2616,common_voice_id_26228264.mp3,Kotamadya Skyros adalah bagian dari unit regional Euboea.,1
2617,common_voice_id_26228265.mp3,Dia mengangkat salah satu alisnya.,1
2618,common_voice_id_26228266.mp3,Banyak lagu di album ini terpengaruh dari puisi dan sastra.,1
2619,common_voice_id_26228282.mp3,Louis mengelola Peternakan Haleakala.,1
2620,common_voice_id_26228283.mp3,Tempat parkir tambahan di dekat stasiun disediakan pada waktu sibuk oleh Dewan Pastoral.,1
2621,common_voice_id_26228284.mp3,"Genom mitokondria ""S. coleoptrata"" telah diurutkan.",1
2622,common_voice_id_26228285.mp3,Bandara itu adalah yang kedua yang memiliki landasan pacu beton di Eropa.,1
2623,common_voice_id_26228286.mp3,Buku ini menjelajahi cara bagaimana politikus Inggris menangani Depresi Besar.,1
2624,common_voice_id_26228292.mp3,Morley bekerja dengan warga Inggris Fred Vine dan Drummond Matthews.,1
2625,common_voice_id_26228293.mp3,"Hewan ini biasanya bertengger di pohon, yang menjadi inspirasi untuk nama khususnya.",1
2626,common_voice_id_26228294.mp3,Dia tampaknya bereksperimen atau menyiksa entitas Ion yang sebelumnya merasuki Kyle Rayner.,1
2627,common_voice_id_26228295.mp3,Anak-anak yang memakai helm bermain hoki di luar.,1
2628,common_voice_id_26228306.mp3,Angka yang ada setelah setiap babak adalah nomor bab.,1
2629,common_voice_id_26228307.mp3,Isaac kemudian menangkap Maurice dan mengeksekusinya.,1
2630,common_voice_id_26228308.mp3,"Setelah itu, yang tersisa digali menjadi Cebu North Road.",1
2631,common_voice_id_26228309.mp3,Sudahkah Anda berubah pikiran?,1
2632,common_voice_id_26228310.mp3,Mohamed Kallon adalah seorang Muslim yang taat dan anggota kelompok etnis Mende.,1
2633,common_voice_id_26228321.mp3,Lokasi tersebut adalah bekas lokasi pabrik Baja Kawasaki.,1
2634,common_voice_id_26228323.mp3,"Di lain waktu, berita yang rumit jika tidak sesuai dengan program itu dapat ditempatkan di sini.",1
2635,common_voice_id_26228324.mp3,Di sini dia bertemu seorang pria tuli dan bisu.,1
2636,common_voice_id_26228325.mp3,Nama kotamadya itu kemudian diubah menjadi Vikna.,1
2637,common_voice_id_26228336.mp3,"Malam itu gelap, dan langit, cerah.",1
2638,common_voice_id_26228337.mp3,"Namun jika kekuasaan besar berusaha mengendalikan kekuasaan yang lebih kecil, aliansi bilateral akan lebih efektif.",1
2639,common_voice_id_26228338.mp3,Dia menghadiri School of Music Federal University of Bahia.,1
2640,common_voice_id_26228339.mp3,Properti ini berganti nama menjadi Rancho Obi-Wan.,1
2641,common_voice_id_26228340.mp3,"Dari sana, mereka berkunjung ke Hindia Barat.",1
2642,common_voice_id_26228351.mp3,Dalam pertunjukan biasa ada aktor di atas panggung dan spektator yang menyaksikan dramanya.,1
2643,common_voice_id_26228352.mp3,Hanya aku yang tidak pernah bisa mengingat aturan itu.,1
2644,common_voice_id_26228354.mp3,"Dalam mitologi Yunani, itu juga merupakan nama para dewa sungai-sungai tersebut.",1
2645,common_voice_id_26228355.mp3,Metode ini bebas kontak dan tidak memerlukan teknik persiapan sampel.,1
2646,common_voice_id_26228361.mp3,Perhatian harus diterapkan ketika menggunakan korelasi silang untuk sistem non-linier.,1
2647,common_voice_id_26228362.mp3,Kulit mereka mengandung racun yang bisa berbahaya jika tertelan.,1
2648,common_voice_id_26228363.mp3,"Dia berkata tentang dirinya sendiri bahwa, “Pikiran yang terbuka bukanlah bagian dari warisan saya.",1
2649,common_voice_id_26228365.mp3,Kochel juga dikenal dengan bendungan hidroelektriknya.,1
2650,common_voice_id_26228376.mp3,Seorang wanita tua membuat panekuk.,1
2651,common_voice_id_26228377.mp3,Selama pertarungan ini Fedoruk tersungkur terkena tangan kanan liar Orr.,1
2652,common_voice_id_26228378.mp3,Pria memesan di kedai kopi.,1
2653,common_voice_id_26228379.mp3,Weisskopf adalah anggota Akademi Ilmu Pengetahuan Nasional.,1
2654,common_voice_id_26228391.mp3,Kedua earl dipanggil ke London untuk menjelaskan tindakan mereka.,1
2655,common_voice_id_26228394.mp3,"Dua tahun kemudian, fasilitas produksi pindah ke San Leandro, California.",1
2656,common_voice_id_26228395.mp3,"Benarkah, sayang?",1
2657,common_voice_id_26228411.mp3,"Merasa bahwa jiwa cacat lainnya akan mencari dirinya, dia menunggu kedatangan perempuan itu.",1
2658,common_voice_id_26228413.mp3,Na'Toth pulang ke Narn di beberapa waktu selama musim kedua.,1
2659,common_voice_id_26228414.mp3,East Riddlesden Hall dalam perawatan National Trust.,1
2660,common_voice_id_26228415.mp3,Pembukaan port untuk kartu ekspansi juga ditingkatkan.,1
2661,common_voice_id_26228416.mp3,Produk Udara dan Bahan Kimia letaknya berdekatan dengan Trexlertown.,1
2662,common_voice_id_26228418.mp3,Di sebelah utara berbatasan dengan kota Parker.,1
2663,common_voice_id_26228421.mp3,Pada waktu inilah Pella mencapai ukuran terbesarnya.,1
2664,common_voice_id_26228426.mp3,Sungai Avon dan Terusan Oxford mengalir di antara Newbold dan Rugby.,1
2665,common_voice_id_26228427.mp3,Truk dagang dilarang.,1
2666,common_voice_id_26228428.mp3,Catatan mereka telah dihapus.,1
2667,common_voice_id_26228429.mp3,“Selma” masuk dalam daftar sepuluh besar para kritikus.,1
2668,common_voice_id_26228441.mp3,Juga terdapat desa Killyleagh.,1
2669,common_voice_id_26228442.mp3,Menanam jenis benih tertentu juga termasuk dalam aplikasi udara.,1
2670,common_voice_id_26228443.mp3,Kota itu saat ini membentuk bagian dari wilayah statistik mikropolitan Ozark.,1
2671,common_voice_id_26228444.mp3,"Yang terakhir disebut sebagai ""Blok Timur"".",1
2672,common_voice_id_26228451.mp3,"Dia adalah kolonis putih, atau “blancs”.",1
2673,common_voice_id_26228452.mp3,Lihat juga Operation Tremor.,1
2674,common_voice_id_26228453.mp3,Tetapi mengapa saya tidak diberi tahu?,1
2675,common_voice_id_26228454.mp3,Struktur operasional yang sederhana ini mengajarkan teknik dan konvensi teater yang rumit.,1
2676,common_voice_id_26228455.mp3,Seorang pria memaku barel bersama.,1
2677,common_voice_id_26228466.mp3,Sampai Hari Penghakiman.,1
2678,common_voice_id_26228467.mp3,Dua video pertama menampilkan penataan audio yang lebih inggi satu kunci ketimbang versi albumnya.,1
2679,common_voice_id_26228468.mp3,Kapal pemotong adalah kapal paling canggih yang pernah dibangun untuk Kesatuan Penjaga Pantai.,1
2680,common_voice_id_26228470.mp3,Implementasi algoritmenya tersedia di Emacs.,1
2681,common_voice_id_26228488.mp3,Buku ini membuat bulu kudukku berdiri.,1
2682,common_voice_id_26228490.mp3,"Saudara-saudara perempuannya adalah Bobbi Jo Parsons, Peggy Sue Kennedy, dan Janie Lee Dye.",1
2683,common_voice_id_26228492.mp3,"Aku berani bertaruh, dia pasti tahu bagaimana cara menyampaikan semuanya baik-baik saja.",1
2684,common_voice_id_26228494.mp3,"Dia mendapat pelatihan di California, Michigan, Colorado, Florida, dan Virginia.",1
2685,common_voice_id_26228495.mp3,Lanskapnya adalah negara domba secara umum.,1
2686,common_voice_id_26228503.mp3,"Secara gaya bahasa, film ini mirip dengan Dick Tracy.",1
2687,common_voice_id_26228504.mp3,"Kedua pria itu berasal dari Gilead, Maine.",1
2688,common_voice_id_26228506.mp3,Dermaga tender digunakan untuk menerima perahu kecil di terminal.,1
2689,common_voice_id_26228507.mp3,Sungai Lomná mengalir melewati desa.,1
2690,common_voice_id_26228526.mp3,"Sejak saat itu, pengaruh Salon tidak diragukan.",1
2691,common_voice_id_26228527.mp3,Mobil hijau itu menyusul kami di tikungan berbahaya.,1
2692,common_voice_id_26228528.mp3,Tapi itu bukan lelucon - itu mengerikan.,1
2693,common_voice_id_26228531.mp3,Ini adalah salah satu jenis ikan paling melimpah di Laut Azov.,1
2694,common_voice_id_26228533.mp3,"Pemburu gelap juga datang, untuk mengumpulkan telur untuk dijual di pasar.",1
2695,common_voice_id_26228543.mp3,Ular cokelat timur kawin selama musim semi; mereka adalah hewan ovipar.,1
2696,common_voice_id_26228544.mp3,"Orang yang mengancam, membunuh, berbahaya.",1
2697,common_voice_id_26228545.mp3,Kemudian ia menyalakan api dan meninggalkan saya.,1
2698,common_voice_id_26228546.mp3,Ini mengalami beberapa perubahan besar lainnya pada perbatasannya selama bertahun-tahun.,1
2699,common_voice_id_26228547.mp3,"Early Stars dibuat dari kayu, tetapi kapal modern umumnya terbuat dari fiberglass.",1
2700,common_voice_id_26228558.mp3,Terdapat tiga area bisnis atau perbelanjaan di wilayah Kota Canyon Lake.,1
2701,common_voice_id_26228559.mp3,"Browser itu dikembangkan oleh Camino Project, sebuah organisasi komunitas.",1
2702,common_voice_id_26228560.mp3,Tren baru dimulai di American Co-masonry.,1
2703,common_voice_id_26228561.mp3,Barzani dan Ahmad diketahui tidak saling menyukai.,1
2704,common_voice_id_26228562.mp3,Kekuatannya berasal dari penggunaan energi kinetik untuk melawan musuh.,1
2705,common_voice_id_26228573.mp3,Setiap warna film individu menentukan perilakunya.,1
2706,common_voice_id_26228574.mp3,Para ahli geografi kuno tidak berhasil menyampaikan definisi perbatasan Samnium secara tepat.,1
2707,common_voice_id_26228575.mp3,Protein Wnt memandu akson sumsum tulang belakang ke arah anterior-posterior.,1
2708,common_voice_id_26228576.mp3,Kita harus memisahkan kucing-kucing dari anjing-anjing.,1
2709,common_voice_id_26228593.mp3,J Robinson dari Minnesota telah diberi penghargaan tujuh kali di sepanjang kariernya.,1
2710,common_voice_id_26228594.mp3,Unit itu dibentuk dari dua kendaraan bermotor.,1
2711,common_voice_id_26228595.mp3,Komunitas kecil Elf mungkin tetap bertahan selama beberapa waktu.,1
2712,common_voice_id_26228596.mp3,Vickery adalah pedagang terkenal dan patron terkemuka di Gereja Methodist.,1
2713,common_voice_id_26228608.mp3,Dewannya terdiri dari enam wali kota dan enam penasihat.,1
2714,common_voice_id_26228609.mp3,"Sebagai penentang tindakan penyiksaan yang gigih, Zita telah membuat dua film yang membahas masalah ini.",1
2715,common_voice_id_26228610.mp3,Bengston mengatakan bahwa kursi-kursi tersebut berwarna merah.,1
2716,common_voice_id_26228611.mp3,Menghilangkan karakter 'T' itu diperbolehkan berdasarkan kesepakatan bersama.,1
2717,common_voice_id_26228612.mp3,Ada beberapa variasi dalam bendera resmi wilayah lain.,1
2718,common_voice_id_26228627.mp3,Sering kali keluarga menyediakan perawatan untuk lansia.,1
2719,common_voice_id_26228630.mp3,"Keputusannya, seperti semua keputusan di Acorn, diputuskan melalui konsensus.",1
2720,common_voice_id_26228631.mp3,Sistem FoxTrax menerima beragam ulasan.,1
2721,common_voice_id_26228632.mp3,Tim itu diperkuat Andy Malcolm yang merupakan pesepakbola England Youth International pertama West Ham.,1
2722,common_voice_id_26228636.mp3,Dua pria yang memakai jaket merah dan kuning melihat ke perairan dari sebuah perahu merah-oranye.,1
2723,common_voice_id_26228638.mp3,Sekelompok orang berdiri di dalam ruangan,1
2724,common_voice_id_26228640.mp3,Dua pemuda sedang mencari furnitur di toko perabotan.,1
2725,common_voice_id_26228642.mp3,"Menurut putrinya, dia awalnya merasa sulit menyesuaikan diri dari panggung ke layar.",1
2726,common_voice_id_26228658.mp3,Risalah ini dibagi menjadi sepuluh buku.,1
2727,common_voice_id_26228663.mp3,East Harlem mulai merasakan efek gentrifikasi.,1
2728,common_voice_id_26228679.mp3,Memiliki kumpulan ikan karang dan terumbu yang kaya.,1
2729,common_voice_id_26228680.mp3,"Henshaw juga tampil sebagai bintang tamu dalam dua episode ""The Littlest Hobo"".",1
2730,common_voice_id_26228681.mp3,Hutan ini tersertifikasi untuk kegiatan penebangan.,1
2731,common_voice_id_26228682.mp3,Saat dipenjari mereka menjalin pertemanan dengan tahanan lain.,1
2732,common_voice_id_26228683.mp3,Dia tidak ingin mengikuti jejak ayahnya untuk menjadi penjahit.,1
2733,common_voice_id_26228694.mp3,Teknologi tersebut mampu memulihkan kondisi bot menjadi sempurna kembali.,1
2734,common_voice_id_26228695.mp3,Pelayan itu membawa mantel putih Celia.,1
2735,common_voice_id_26228715.mp3,Capella berada di tengah-tengah antara Emerald dan Clermont di Gregory Highway.,1
2736,common_voice_id_26228716.mp3,Ini bersimpati mendukung pandangan non-sekuler demokratis dan progresif.,1
2737,common_voice_id_26228717.mp3,Banyak fotonya yang masih disimpan oleh para kolektor pribadi.,1
2738,common_voice_id_26228719.mp3,Ibu Henshall adalah seorang perawat dan ayahnya seorang pedagang.,1
2739,common_voice_id_26228720.mp3,Basava Premanand dianggap sebagai keturunan spiritual Kovoor di India.,1
2740,common_voice_id_26228722.mp3,Plat juga dapat dimodifikasi dengan tambahan biaya.,1
2741,common_voice_id_26228739.mp3,"Namun, kedatangan Toyota bukanlah tanpa kontroversi.",1
2742,common_voice_id_26228740.mp3,Sekarang dia sedang mengerjakan novel baru.,1
2743,common_voice_id_26228741.mp3,Northrop and McDonnell Douglas membentuk tim dengan perjanjian serupa.,1
2744,common_voice_id_26228742.mp3,Studio pihak kedua Left Field bertanggung jawab untuk pengembangan.,1
2745,common_voice_id_26228743.mp3,Penyebab kematian belum diketahui.,1
2746,common_voice_id_26228746.mp3,"Produk ini disebut ""sailonggu"".",1
2747,common_voice_id_26228747.mp3,Anda tidak perlu menunggu sampai bulan Januari.,1
2748,common_voice_id_26228751.mp3,"Dalam gerakan kelima, Nicolas diangkat menjadi Uskup Myra.",1
2749,common_voice_id_26228753.mp3,"Namun, mereka kalah dari Charlotte Hounds di semifinal.",1
2750,common_voice_id_26228761.mp3,"Terkadang, bunyi pengucapan di wilayah yang berbatasan dengan Belarus dan Ukraina adalah bunyi desah dari glotis (frikatif glotis).",1
2751,common_voice_id_26228762.mp3,"Pasukan Caecina, sekarang tanpa jenderalnya, maju ke Cremona.",1
2752,common_voice_id_26228764.mp3,Jalan ceritanya berkembang di pembuatan ulang Game Boy Advance.,1
2753,common_voice_id_26228765.mp3,Butler berterus terang mengenai statusnya sebagai gay.,1
2754,common_voice_id_26228768.mp3,Saya memiliki uangnya saya harus membeli domba saya.,1
2755,common_voice_id_26228770.mp3,"Atau, dapat ditingkatkan dengan sinar ultraviolet.",1
2756,common_voice_id_26228773.mp3,Waktu berlalu.,1
2757,common_voice_id_26228780.mp3,Para ilmuwan tidak yakin tentang penyebab kematian ini.,1
2758,common_voice_id_26228791.mp3,Hal ini turut menyebabkan penurunan kinerja ketika memainkan gim tertentu.,1
2759,common_voice_id_26228792.mp3,Dia tidak menginginkan pembicaraan apa pun saat ini.,1
2760,common_voice_id_26228793.mp3,"Taran, Gurgi dan Fflewddur menyelidiki tempat tinggal Morda, tetapi semuanya terkena perangkap jeratnya.",1
2761,common_voice_id_26228794.mp3,"Putra ketiganya, Richard, meninggal karena demam scarlet saat berusia empat tahun.",1
2762,common_voice_id_26228795.mp3,Dia memperluas Aula dan membangunnya kembali dengan batu bata buatan tangan setempat.,1
2763,common_voice_id_26228800.mp3,Lihat panjang tubuh dan leher yang memanjang itu.,1
2764,common_voice_id_26228802.mp3,Izin biasanya diberikan melalui Piagam Kerajaan.,1
2765,common_voice_id_26228804.mp3,Tim Sepak Bola bertanding di Collingwood Cup.,1
2766,common_voice_id_26228805.mp3,Bahasa Inggris telah menjadi bahasa yang umum.,1
2767,common_voice_id_26228811.mp3,Dia sekarang tinggal di Swedia dan Belanda.,1
2768,common_voice_id_26228813.mp3,Ini pilihan yang paling tidak disukai untuk digunakan jika perawatan lain yang tersedia gagal.,1
2769,common_voice_id_26228814.mp3,Gereja Baptis Zion di Atlanta.,1
2770,common_voice_id_26228815.mp3,Pada masa itu toko-toko tersebut beroperasi baik sebagai toko eceran maupun produksi.,1
2771,common_voice_id_26228816.mp3,"Landasan terbang, jalur taksi, dan tarmak diperluas dan ditingkatkan.",1
2772,common_voice_id_26228818.mp3,"Kontrak lisensi untuk Indiana Jones, Star Wars, dan Xena tetap dimiliki oleh Creative Design Group.",1
2773,common_voice_id_26228822.mp3,Perhiasannya berkilauan.,1
2774,common_voice_id_26228824.mp3,"Collett E. Woolman, agen Paroki Ouachita, berasal dari Indiana.",1
2775,common_voice_id_26228839.mp3,Perpustakaan ini terbuka untuk siswa dan umum dengan janji temu.,1
2776,common_voice_id_26228840.mp3,Kepala dan pelindungnya ditutupi dengan sisik yang diperbesar seperti piring.,1
2777,common_voice_id_26228842.mp3,Kejadian ini akan menyebabkan Li Kuo sangat membenci Huige nanti.,1
2778,common_voice_id_26228843.mp3,"Kerucut jantan panjang, dan melepaskan serbuk sari di awal musim semi.",1
2779,common_voice_id_26228850.mp3,Dia lalu mendaftar di Universitas Kolumbia untuk studi pascasarjana.,1
